{
  "schema_version": "baseline-v2",
  "project": {
    "name": "EvoOM Guard",
    "version": "4.0.1"
  },
  "capture_source": {
    "commit_sha": "00427917c03266f99a9cf99a21e82ed57c46f226",
    "tree_sha": "df5e4bde293549797041cc8976604a4ee651511f",
    "merged_as": "51977c3a6c7f9bba54699e56c217f15eb737321b",
    "relationship": "identical-tree",
    "branch": "agent/v4-0-1-release-correctness",
    "generated_utc": "2026-07-20T17:32:13Z",
    "kind": "frozen-reference-captures",
    "reproduction_scope": "semantic-reference-and-exact-committed-bytes"
  },
  "release": {
    "repository": "EvoRiseKsa/EvoOM-Guard-m",
    "tag": "v4.0.1",
    "commit_sha": "5ed7e84017619496521b813f859a6a8bf0a2b1df",
    "tree_sha": "434d09817bd166be4e123836b941ee1b808d17bf",
    "asset_build_commit_sha": "5ed7e84017619496521b813f859a6a8bf0a2b1df",
    "state": "published",
    "immutable": true,
    "prerelease": false,
    "published_utc": "2026-07-20T18:30:01Z",
    "manifest_artifact_id": "release-manifest-json",
    "pyz_artifact_id": "pyz-evo-guard-pyz",
    "checksum_artifact_id": "sha256sums-v4-0-1-txt"
  },
  "release_workflow": {
    "run_id": 29766032321,
    "attempt": 1,
    "head_sha": "5ed7e84017619496521b813f859a6a8bf0a2b1df",
    "conclusion": "success",
    "pytest": {
      "passed": 1157,
      "skipped": 11,
      "subtests_passed": 52
    },
    "linux_e2e_passed": [10, 7],
    "windows_e2e_passed": 10,
    "evidence_scope": "recorded-external-observation"
  },
  "action_contract": {
    "snapshot_artifact_id": "action-action-yml",
    "inputs": {
      "allow": {"required": false, "default": ""},
      "allow-new-tests": {"required": false, "default": "false"},
      "base-ref": {"required": false, "default": ""},
      "baseline-evidence": {"required": false, "default": "false"},
      "blackbox": {"required": false, "default": "false"},
      "blackbox-only": {"required": false, "default": "false"},
      "comment": {"required": false, "default": "true"},
      "diff-coverage": {"required": false, "default": "false"},
      "docker-image": {"required": false, "default": ""},
      "docker-network": {"required": false, "default": ""},
      "expect-verifier-pack-sha256": {"required": false, "default": ""},
      "fail-on": {"required": false, "default": "any-non-pass"},
      "isolation": {"required": false, "default": ""},
      "mem-limit": {"required": false, "default": ""},
      "min-diff-coverage": {"required": false, "default": ""},
      "protected": {"required": false, "default": ""},
      "require-candidate-isolation": {"required": false, "default": ""},
      "require-demonstrated-fix": {"required": false, "default": "false"},
      "require-report-integrity": {"required": false, "default": ""},
      "sarif": {"required": false, "default": ""},
      "strict-harness": {"required": false, "default": ""},
      "test-command": {"required": false, "default": ""},
      "timeout": {"required": false, "default": ""},
      "trust-setup-on-host": {"required": false, "default": ""},
      "verifier-pack": {"required": false, "default": ""}
    },
    "outputs": {
      "head-sha": "${{ steps.guard.outputs.head-sha }}",
      "json-path": "${{ steps.guard.outputs.json-path }}",
      "policy-sha": "${{ steps.guard.outputs.policy-sha }}",
      "report-path": "${{ steps.guard.outputs.report-path }}",
      "verdict": "${{ steps.guard.outputs.verdict }}"
    }
  },
  "evidence_formats": {
    "record_schema": "1.11",
    "sarif": "2.1.0",
    "evidence_signature": "Ed25519 detached exact bytes",
    "pack_digest": "EVOGUARD_PACK_V2",
    "junit_digest_format": "JUNIT_XML_SHA256"
  },
  "artifact_inventory": [
    {"id": "action-action-yml", "path": "action/action.yml", "size_bytes": 27461, "sha256": "06aedd417c7ad109f4a518a42d552abccb49122c0606a35bcf40607fbafc933c"},
    {"id": "artifacts-baseline-sign-pub-pem", "path": "artifacts/baseline-sign-pub.pem", "size_bytes": 113, "sha256": "8021694dd0769c7d956ff34ebe0da353556301f7e743131323120b3038721ab7"},
    {"id": "artifacts-record-pass-repo-signed-json", "path": "artifacts/record-pass-repo-signed.json", "size_bytes": 4770, "sha256": "4e662fef4445a4a9b1cec441f8a0d65e4ab47044f8b255705623b23fbd31b5f9"},
    {"id": "artifacts-record-pass-repo-signed-json-sig", "path": "artifacts/record-pass-repo-signed.json.sig", "size_bytes": 89, "sha256": "8faff9f2d531c09b8f661b73a04e7cc8007e6d3d8592fae400c8e682f85bdfa8"},
    {"id": "benchmarks-results-jsonl", "path": "benchmarks/results.jsonl", "size_bytes": 4242, "sha256": "2b98072aad55f2ba34e8e7d29701a56471db8772886a0a0cd7dee0c5ca41a552"},
    {"id": "commands-cli-help-txt", "path": "commands/cli_help.txt", "size_bytes": 12848, "sha256": "7cfd9fc514f5b1d3e97010374e40f17d8f9de907c0ebf9b1668d5693905c4030"},
    {"id": "commands-init-help-txt", "path": "commands/init_help.txt", "size_bytes": 3618, "sha256": "58a086c88bf013000e2dac778fefe95e19b97bc3bd447b59939a59305ca395c4"},
    {"id": "commands-version-txt", "path": "commands/version.txt", "size_bytes": 36, "sha256": "582bf415f56c15a0e82dad12b344359160be109783fda62f16da2d80423a3a14"},
    {"id": "evidence-record-fail-repo-json", "path": "evidence/record-fail-repo.json", "size_bytes": 4849, "sha256": "987dfc019bdc58fe0423bf25093a361744e4d3c9a887682eb109b51980b3463c"},
    {"id": "evidence-record-pass-repo-json", "path": "evidence/record-pass-repo.json", "size_bytes": 4636, "sha256": "ed6fd7dc7c594eab6029c443b55df3068c624562a4685843d897e078d9f1d57a"},
    {"id": "evidence-record-rejected-harness-json", "path": "evidence/record-rejected-harness.json", "size_bytes": 4533, "sha256": "cc521017b918f1522c5a0cb877962982a740c002b722e46b3a01e1b4969da80f"},
    {"id": "evidence-report-fail-repo-md", "path": "evidence/report-fail-repo.md", "size_bytes": 1274, "sha256": "c2a3c6c7f8e0a98e837e9bf9d43ce59d0df7d688a71ffecd056f059d07d6c64d"},
    {"id": "evidence-report-pass-repo-md", "path": "evidence/report-pass-repo.md", "size_bytes": 1312, "sha256": "a11ac4a09283f9f532f56004daa838300c583669b99561606e4dcef69f574032"},
    {"id": "evidence-report-rejected-harness-md", "path": "evidence/report-rejected-harness.md", "size_bytes": 998, "sha256": "235090577a9e36670933068ad5e7ff91dfd12b192af81d69ee4acc93eb8a917f"},
    {"id": "evidence-sarif-fail-repo-json", "path": "evidence/sarif-fail-repo.json", "size_bytes": 1188, "sha256": "c06ee0f945d8c877f6fd6ee40ed575c72f3073a4c713c521fe1bfa3086c2c283"},
    {"id": "evidence-sarif-pass-repo-json", "path": "evidence/sarif-pass-repo.json", "size_bytes": 347, "sha256": "5dd267d5af04f32155ccb2f3866314465a9b36dfc6314e943b6fcf068f341708"},
    {"id": "evidence-sarif-rejected-harness-json", "path": "evidence/sarif-rejected-harness.json", "size_bytes": 1371, "sha256": "1c85a88210add801a79d9b5078a8a49bcc5e43c5074bc8e615be30f76966136c"},
    {"id": "packs-blackbox-cli-pack-json", "path": "packs/blackbox-cli/pack.json", "size_bytes": 129, "sha256": "04a1a0fc6655c93093578bb792f39b8dfc6636827fa0a1405a1697fe7d9836df"},
    {"id": "packs-blackbox-cli-test-protocol-py", "path": "packs/blackbox-cli/test_protocol.py", "size_bytes": 1113, "sha256": "49cf18a50f761979dee669bea85c775a8ec7d07f914087f7573bc01df1c9ed34"},
    {"id": "packs-pack-doctor-report-json", "path": "packs/pack-doctor-report.json", "size_bytes": 414, "sha256": "f706e3071a4a51b328e9623d88449783c23f023e39710a62323a16a08a6f414b"},
    {"id": "pyz-evo-guard-pyz", "path": "pyz/evo-guard.pyz", "size_bytes": 1099446, "sha256": "81a5139e1e0f3c5ce1f9180db85c699eec305474f9588f7d2831099defdce2f7"},
    {"id": "release-manifest-json", "path": "release-manifest.json", "size_bytes": 2219, "sha256": "4bc2662f271a56dff846341684fa545b1f8e558cc61253bac803dc24416f8ad3"},
    {"id": "sha256sums-v4-0-1-txt", "path": "SHA256SUMS_v4.0.1.txt", "size_bytes": 80, "sha256": "c53a9eb496c60ee663dd3c8e8dc1f334035a43ed29cb9b09f4399d9f1380f530"}
  ],
  "vectors": {
    "commands": ["commands-cli-help-txt", "commands-init-help-txt", "commands-version-txt"],
    "records": {
      "FAIL": "evidence-record-fail-repo-json",
      "PASS": "evidence-record-pass-repo-json",
      "REJECTED": "evidence-record-rejected-harness-json"
    },
    "reports": ["evidence-report-fail-repo-md", "evidence-report-pass-repo-md", "evidence-report-rejected-harness-md"],
    "sarif": ["evidence-sarif-fail-repo-json", "evidence-sarif-pass-repo-json", "evidence-sarif-rejected-harness-json"],
    "signed_record": {
      "record": "artifacts-record-pass-repo-signed-json",
      "signature": "artifacts-record-pass-repo-signed-json-sig",
      "public_key": "artifacts-baseline-sign-pub-pem"
    },
    "verifier_pack": {
      "files": ["packs-blackbox-cli-pack-json", "packs-blackbox-cli-test-protocol-py"],
      "doctor_report": "packs-pack-doctor-report-json",
      "digest_format": "EVOGUARD_PACK_V2",
      "sha256": "a4c61f396d35393bfaf5061d9e19aa16a9838f159ee679bf485e880856fb20be"
    }
  },
  "benchmark": {
    "artifact_id": "benchmarks-results-jsonl",
    "schema_version": "bench-v1",
    "rows": 16,
    "timing_semantics": "observational-not-byte-reproducible"
  },
  "corrected_utc": "2026-07-20T20:35:00Z"
}
